{
  "$schema": "https://decantr.ai/schemas/review-pack.v1.json",
  "packVersion": "1.0.0",
  "packType": "review",
  "objective": "Review generated output against the compiled Decantr contract.",
  "target": {
    "platform": "web",
    "framework": "react",
    "runtime": "spa",
    "adapter": "react-vite"
  },
  "preset": null,
  "scope": {
    "appId": "app",
    "pageIds": [
      "home",
      "recipe-detail",
      "feed",
      "chat",
      "generate",
      "cookbooks",
      "cookbook-detail",
      "create",
      "edit",
      "me",
      "my-recipes",
      "public-profile",
      "login"
    ],
    "patternIds": [
      "hero",
      "card-grid",
      "testimonials",
      "cta-section",
      "detail-header",
      "recipefork-fork-provenance",
      "recipefork-chef-ingredients-display",
      "recipefork-chef-instructions-display",
      "recipefork-presentation-display",
      "recipefork-cooking-tips-display",
      "comment-thread",
      "filter-bar",
      "recipefork-activity-feed",
      "chat-thread",
      "chat-input",
      "content-uploader",
      "recipefork-recipe-mode-switch",
      "recipefork-recipe-metadata-form",
      "recipefork-cookbook-assignment",
      "recipefork-simple-recipe-editor",
      "recipefork-chef-ingredients-editor",
      "recipefork-chef-instruction-editor",
      "recipefork-presentation-editor",
      "recipefork-cooking-tips-editor",
      "recipefork-recipe-story-editor",
      "creator-profile",
      "account-settings",
      "stats-overview",
      "auth-form"
    ]
  },
  "requiredSetup": [
    "Read the compiled scaffold and route packs before reviewing code.",
    "Use concrete evidence from the workspace instead of purely stylistic intuition."
  ],
  "allowedVocabulary": [
    "app",
    "recipefork-top-nav",
    "recipefork",
    "light",
    "marketing",
    "seo",
    "sharing",
    "comments",
    "reactions",
    "forking",
    "chef-mode",
    "presentation",
    "cooking-tips",
    "lineage",
    "branch-analytics",
    "social",
    "activity-feed",
    "follows",
    "engagement-ranking",
    "lineage-cues",
    "chat-history",
    "image-upload",
    "auth",
    "generation-history",
    "collections",
    "visibility",
    "recipe-saving",
    "simple-mode",
    "drafts",
    "hydrated-editing",
    "structured-ingredients",
    "hierarchical-instructions",
    "mode-conversion",
    "rich-story",
    "autosave",
    "cookbook-assignment",
    "profile-editing",
    "public-profiles",
    "oauth",
    "supabase-auth",
    "supabase-storage",
    "supabase-realtime",
    "public-browse",
    "gated-actions",
    "hero",
    "card-grid",
    "testimonials",
    "cta-section",
    "detail-header",
    "recipefork-fork-provenance",
    "recipefork-chef-ingredients-display",
    "recipefork-chef-instructions-display",
    "recipefork-presentation-display",
    "recipefork-cooking-tips-display",
    "comment-thread",
    "filter-bar",
    "recipefork-activity-feed",
    "chat-thread",
    "chat-input",
    "content-uploader",
    "recipefork-recipe-mode-switch",
    "recipefork-recipe-metadata-form",
    "recipefork-cookbook-assignment",
    "recipefork-simple-recipe-editor",
    "recipefork-chef-ingredients-editor",
    "recipefork-chef-instruction-editor",
    "recipefork-presentation-editor",
    "recipefork-cooking-tips-editor",
    "recipefork-recipe-story-editor",
    "creator-profile",
    "account-settings",
    "stats-overview",
    "auth-form",
    "route-topology",
    "theme-consistency",
    "treatment-usage",
    "accessibility",
    "responsive-design"
  ],
  "examples": [],
  "antiPatterns": [
    {
      "id": "inline-styles",
      "summary": "Avoid inline style literals as the primary styling path.",
      "guidance": "Move visual styling into tokens.css and treatments.css instead of component-local style objects."
    },
    {
      "id": "hardcoded-colors",
      "summary": "Avoid hardcoded color literals.",
      "guidance": "Use CSS variables and theme decorators instead of hex, rgb, or hsl values."
    },
    {
      "id": "utility-framework-leakage",
      "summary": "Avoid utility-framework leakage as the primary design language.",
      "guidance": "Prefer compiled Decantr treatments and contract vocabulary over ad hoc utility class stacks."
    }
  ],
  "successChecks": [
    {
      "id": "review-contract-baseline",
      "label": "Review findings should use the compiled route, shell, and theme contract as the baseline.",
      "severity": "error"
    },
    {
      "id": "review-evidence",
      "label": "Each critique finding should cite concrete evidence from the generated workspace.",
      "severity": "error"
    },
    {
      "id": "review-remediation",
      "label": "Suggested fixes should point back to code changes or essence updates when contract drift exists.",
      "severity": "warn"
    }
  ],
  "tokenBudget": {
    "target": 1400,
    "max": 2200,
    "strategy": [
      "Prefer route summaries over repeated prose.",
      "Use compact vocabulary lists instead of large reference tables.",
      "Include only task-relevant examples and checks."
    ]
  },
  "data": {
    "reviewType": "app",
    "shell": "recipefork-top-nav",
    "theme": {
      "id": "recipefork",
      "mode": "light",
      "shape": "rounded"
    },
    "routing": "history",
    "features": [
      "marketing",
      "seo",
      "sharing",
      "comments",
      "reactions",
      "forking",
      "chef-mode",
      "presentation",
      "cooking-tips",
      "lineage",
      "branch-analytics",
      "social",
      "activity-feed",
      "follows",
      "engagement-ranking",
      "lineage-cues",
      "chat-history",
      "image-upload",
      "auth",
      "generation-history",
      "collections",
      "visibility",
      "recipe-saving",
      "simple-mode",
      "drafts",
      "hydrated-editing",
      "structured-ingredients",
      "hierarchical-instructions",
      "mode-conversion",
      "rich-story",
      "autosave",
      "cookbook-assignment",
      "profile-editing",
      "public-profiles",
      "oauth",
      "supabase-auth",
      "supabase-storage",
      "supabase-realtime",
      "public-browse",
      "gated-actions"
    ],
    "routes": [
      {
        "pageId": "home",
        "sectionId": "recipefork-landing",
        "path": "/",
        "patternIds": [
          "hero",
          "card-grid",
          "testimonials",
          "cta-section"
        ],
        "shell": "recipefork-top-nav"
      },
      {
        "pageId": "recipe-detail",
        "sectionId": "recipefork-recipe-detail",
        "path": "/recipe/:id",
        "patternIds": [
          "hero",
          "detail-header",
          "recipefork-fork-provenance",
          "recipefork-chef-ingredients-display",
          "recipefork-chef-instructions-display",
          "recipefork-presentation-display",
          "recipefork-cooking-tips-display",
          "comment-thread"
        ],
        "shell": "recipefork-top-nav"
      },
      {
        "pageId": "feed",
        "sectionId": "recipefork-social",
        "path": "/feed",
        "patternIds": [
          "filter-bar",
          "card-grid",
          "recipefork-activity-feed"
        ],
        "shell": "recipefork-top-nav"
      },
      {
        "pageId": "chat",
        "sectionId": "recipefork-ai-kitchen",
        "path": "/chat",
        "patternIds": [
          "chat-thread",
          "chat-input"
        ],
        "shell": "recipefork-top-nav"
      },
      {
        "pageId": "generate",
        "sectionId": "recipefork-ai-kitchen",
        "path": "/generate",
        "patternIds": [
          "content-uploader",
          "detail-header"
        ],
        "shell": "recipefork-top-nav"
      },
      {
        "pageId": "cookbooks",
        "sectionId": "recipefork-cookbooks",
        "path": "/cookbooks",
        "patternIds": [
          "card-grid",
          "cta-section"
        ],
        "shell": "recipefork-top-nav"
      },
      {
        "pageId": "cookbook-detail",
        "sectionId": "recipefork-cookbooks",
        "path": "/cookbooks/:id",
        "patternIds": [
          "hero",
          "card-grid"
        ],
        "shell": "recipefork-top-nav"
      },
      {
        "pageId": "create",
        "sectionId": "recipefork-recipe-authoring",
        "path": "/recipe/new",
        "patternIds": [
          "recipefork-recipe-mode-switch",
          "recipefork-recipe-metadata-form",
          "recipefork-cookbook-assignment",
          "recipefork-simple-recipe-editor",
          "recipefork-chef-ingredients-editor",
          "recipefork-chef-instruction-editor",
          "recipefork-presentation-editor",
          "recipefork-cooking-tips-editor",
          "recipefork-recipe-story-editor"
        ],
        "shell": "recipefork-top-nav"
      },
      {
        "pageId": "edit",
        "sectionId": "recipefork-recipe-authoring",
        "path": "/recipe/edit/:id",
        "patternIds": [
          "detail-header",
          "recipefork-recipe-metadata-form",
          "recipefork-cookbook-assignment",
          "recipefork-simple-recipe-editor",
          "recipefork-chef-ingredients-editor",
          "recipefork-chef-instruction-editor",
          "recipefork-presentation-editor",
          "recipefork-cooking-tips-editor",
          "recipefork-recipe-story-editor"
        ],
        "shell": "recipefork-top-nav"
      },
      {
        "pageId": "me",
        "sectionId": "recipefork-profile",
        "path": "/profile",
        "patternIds": [
          "creator-profile",
          "account-settings",
          "stats-overview",
          "card-grid"
        ],
        "shell": "recipefork-top-nav"
      },
      {
        "pageId": "my-recipes",
        "sectionId": "recipefork-profile",
        "path": "/recipes",
        "patternIds": [
          "stats-overview",
          "filter-bar",
          "card-grid"